{
  "v": 1,
  "id": "kampung-senja-v1",
  "width": 64,
  "height": 64,
  "spawn": {
    "x": 32,
    "y": 32
  },
  "buildings": [
    {
      "id": "plaza",
      "x": 32,
      "y": 29,
      "width": 1,
      "height": 1,
      "entrance": {
        "x": 32,
        "y": 32
      }
    },
    {
      "id": "warkop",
      "x": 16,
      "y": 17,
      "width": 1,
      "height": 1,
      "entrance": {
        "x": 16,
        "y": 24
      }
    },
    {
      "id": "duck",
      "x": 46,
      "y": 18,
      "width": 1,
      "height": 1,
      "entrance": {
        "x": 45,
        "y": 24
      }
    },
    {
      "id": "race",
      "x": 52,
      "y": 36,
      "width": 1,
      "height": 1,
      "entrance": {
        "x": 45,
        "y": 45
      }
    },
    {
      "id": "penalty",
      "x": 28,
      "y": 40,
      "width": 1,
      "height": 1,
      "entrance": {
        "x": 28,
        "y": 46
      }
    },
    {
      "id": "garden",
      "x": 14,
      "y": 42,
      "width": 1,
      "height": 1,
      "entrance": {
        "x": 14,
        "y": 44
      }
    },
    {
      "id": "river",
      "x": 53,
      "y": 29,
      "width": 1,
      "height": 1,
      "entrance": {
        "x": 52,
        "y": 32
      }
    },
    {
      "id": "arcade",
      "x": 41,
      "y": 18,
      "width": 1,
      "height": 1,
      "entrance": {
        "x": 41,
        "y": 24
      }
    }
  ],
  "districts": [
    {
      "id": "warkop",
      "x": 7,
      "y": 15,
      "width": 17,
      "height": 13
    },
    {
      "id": "central",
      "x": 25,
      "y": 26,
      "width": 13,
      "height": 13
    },
    {
      "id": "duck",
      "x": 39,
      "y": 16,
      "width": 13,
      "height": 12
    },
    {
      "id": "garden",
      "x": 7,
      "y": 36,
      "width": 14,
      "height": 13
    },
    {
      "id": "penalty",
      "x": 24,
      "y": 40,
      "width": 9,
      "height": 12
    },
    {
      "id": "race",
      "x": 38,
      "y": 37,
      "width": 15,
      "height": 11
    },
    {
      "id": "river",
      "x": 54,
      "y": 27,
      "width": 8,
      "height": 9
    }
  ],
  "obstacles": [
    {
      "x": 0,
      "y": 0
    },
    {
      "x": 1,
      "y": 0
    },
    {
      "x": 2,
      "y": 0
    },
    {
      "x": 3,
      "y": 0
    },
    {
      "x": 4,
      "y": 0
    },
    {
      "x": 5,
      "y": 0
    },
    {
      "x": 6,
      "y": 0
    },
    {
      "x": 7,
      "y": 0
    },
    {
      "x": 8,
      "y": 0
    },
    {
      "x": 9,
      "y": 0
    },
    {
      "x": 10,
      "y": 0
    },
    {
      "x": 11,
      "y": 0
    },
    {
      "x": 12,
      "y": 0
    },
    {
      "x": 13,
      "y": 0
    },
    {
      "x": 14,
      "y": 0
    },
    {
      "x": 15,
      "y": 0
    },
    {
      "x": 16,
      "y": 0
    },
    {
      "x": 17,
      "y": 0
    },
    {
      "x": 18,
      "y": 0
    },
    {
      "x": 19,
      "y": 0
    },
    {
      "x": 20,
      "y": 0
    },
    {
      "x": 21,
      "y": 0
    },
    {
      "x": 22,
      "y": 0
    },
    {
      "x": 23,
      "y": 0
    },
    {
      "x": 24,
      "y": 0
    },
    {
      "x": 25,
      "y": 0
    },
    {
      "x": 26,
      "y": 0
    },
    {
      "x": 27,
      "y": 0
    },
    {
      "x": 28,
      "y": 0
    },
    {
      "x": 29,
      "y": 0
    },
    {
      "x": 30,
      "y": 0
    },
    {
      "x": 31,
      "y": 0
    },
    {
      "x": 32,
      "y": 0
    },
    {
      "x": 33,
      "y": 0
    },
    {
      "x": 34,
      "y": 0
    },
    {
      "x": 35,
      "y": 0
    },
    {
      "x": 36,
      "y": 0
    },
    {
      "x": 37,
      "y": 0
    },
    {
      "x": 38,
      "y": 0
    },
    {
      "x": 39,
      "y": 0
    },
    {
      "x": 40,
      "y": 0
    },
    {
      "x": 41,
      "y": 0
    },
    {
      "x": 42,
      "y": 0
    },
    {
      "x": 43,
      "y": 0
    },
    {
      "x": 44,
      "y": 0
    },
    {
      "x": 45,
      "y": 0
    },
    {
      "x": 46,
      "y": 0
    },
    {
      "x": 47,
      "y": 0
    },
    {
      "x": 48,
      "y": 0
    },
    {
      "x": 49,
      "y": 0
    },
    {
      "x": 50,
      "y": 0
    },
    {
      "x": 51,
      "y": 0
    },
    {
      "x": 52,
      "y": 0
    },
    {
      "x": 53,
      "y": 0
    },
    {
      "x": 54,
      "y": 0
    },
    {
      "x": 55,
      "y": 0
    },
    {
      "x": 56,
      "y": 0
    },
    {
      "x": 57,
      "y": 0
    },
    {
      "x": 58,
      "y": 0
    },
    {
      "x": 59,
      "y": 0
    },
    {
      "x": 60,
      "y": 0
    },
    {
      "x": 61,
      "y": 0
    },
    {
      "x": 62,
      "y": 0
    },
    {
      "x": 63,
      "y": 0
    },
    {
      "x": 0,
      "y": 1
    },
    {
      "x": 1,
      "y": 1
    },
    {
      "x": 2,
      "y": 1
    },
    {
      "x": 3,
      "y": 1
    },
    {
      "x": 4,
      "y": 1
    },
    {
      "x": 5,
      "y": 1
    },
    {
      "x": 6,
      "y": 1
    },
    {
      "x": 7,
      "y": 1
    },
    {
      "x": 8,
      "y": 1
    },
    {
      "x": 9,
      "y": 1
    },
    {
      "x": 10,
      "y": 1
    },
    {
      "x": 11,
      "y": 1
    },
    {
      "x": 12,
      "y": 1
    },
    {
      "x": 13,
      "y": 1
    },
    {
      "x": 14,
      "y": 1
    },
    {
      "x": 15,
      "y": 1
    },
    {
      "x": 16,
      "y": 1
    },
    {
      "x": 17,
      "y": 1
    },
    {
      "x": 18,
      "y": 1
    },
    {
      "x": 19,
      "y": 1
    },
    {
      "x": 20,
      "y": 1
    },
    {
      "x": 21,
      "y": 1
    },
    {
      "x": 22,
      "y": 1
    },
    {
      "x": 23,
      "y": 1
    },
    {
      "x": 24,
      "y": 1
    },
    {
      "x": 25,
      "y": 1
    },
    {
      "x": 26,
      "y": 1
    },
    {
      "x": 27,
      "y": 1
    },
    {
      "x": 28,
      "y": 1
    },
    {
      "x": 29,
      "y": 1
    },
    {
      "x": 30,
      "y": 1
    },
    {
      "x": 31,
      "y": 1
    },
    {
      "x": 32,
      "y": 1
    },
    {
      "x": 33,
      "y": 1
    },
    {
      "x": 34,
      "y": 1
    },
    {
      "x": 35,
      "y": 1
    },
    {
      "x": 36,
      "y": 1
    },
    {
      "x": 37,
      "y": 1
    },
    {
      "x": 38,
      "y": 1
    },
    {
      "x": 39,
      "y": 1
    },
    {
      "x": 40,
      "y": 1
    },
    {
      "x": 41,
      "y": 1
    },
    {
      "x": 42,
      "y": 1
    },
    {
      "x": 43,
      "y": 1
    },
    {
      "x": 44,
      "y": 1
    },
    {
      "x": 45,
      "y": 1
    },
    {
      "x": 46,
      "y": 1
    },
    {
      "x": 47,
      "y": 1
    },
    {
      "x": 48,
      "y": 1
    },
    {
      "x": 49,
      "y": 1
    },
    {
      "x": 50,
      "y": 1
    },
    {
      "x": 51,
      "y": 1
    },
    {
      "x": 52,
      "y": 1
    },
    {
      "x": 53,
      "y": 1
    },
    {
      "x": 54,
      "y": 1
    },
    {
      "x": 55,
      "y": 1
    },
    {
      "x": 56,
      "y": 1
    },
    {
      "x": 57,
      "y": 1
    },
    {
      "x": 58,
      "y": 1
    },
    {
      "x": 59,
      "y": 1
    },
    {
      "x": 60,
      "y": 1
    },
    {
      "x": 61,
      "y": 1
    },
    {
      "x": 62,
      "y": 1
    },
    {
      "x": 63,
      "y": 1
    },
    {
      "x": 0,
      "y": 2
    },
    {
      "x": 1,
      "y": 2
    },
    {
      "x": 2,
      "y": 2
    },
    {
      "x": 3,
      "y": 2
    },
    {
      "x": 4,
      "y": 2
    },
    {
      "x": 5,
      "y": 2
    },
    {
      "x": 6,
      "y": 2
    },
    {
      "x": 7,
      "y": 2
    },
    {
      "x": 8,
      "y": 2
    },
    {
      "x": 9,
      "y": 2
    },
    {
      "x": 10,
      "y": 2
    },
    {
      "x": 11,
      "y": 2
    },
    {
      "x": 12,
      "y": 2
    },
    {
      "x": 13,
      "y": 2
    },
    {
      "x": 14,
      "y": 2
    },
    {
      "x": 15,
      "y": 2
    },
    {
      "x": 16,
      "y": 2
    },
    {
      "x": 17,
      "y": 2
    },
    {
      "x": 18,
      "y": 2
    },
    {
      "x": 19,
      "y": 2
    },
    {
      "x": 20,
      "y": 2
    },
    {
      "x": 21,
      "y": 2
    },
    {
      "x": 22,
      "y": 2
    },
    {
      "x": 23,
      "y": 2
    },
    {
      "x": 24,
      "y": 2
    },
    {
      "x": 25,
      "y": 2
    },
    {
      "x": 26,
      "y": 2
    },
    {
      "x": 27,
      "y": 2
    },
    {
      "x": 28,
      "y": 2
    },
    {
      "x": 29,
      "y": 2
    },
    {
      "x": 30,
      "y": 2
    },
    {
      "x": 31,
      "y": 2
    },
    {
      "x": 32,
      "y": 2
    },
    {
      "x": 33,
      "y": 2
    },
    {
      "x": 34,
      "y": 2
    },
    {
      "x": 35,
      "y": 2
    },
    {
      "x": 36,
      "y": 2
    },
    {
      "x": 37,
      "y": 2
    },
    {
      "x": 38,
      "y": 2
    },
    {
      "x": 39,
      "y": 2
    },
    {
      "x": 40,
      "y": 2
    },
    {
      "x": 41,
      "y": 2
    },
    {
      "x": 42,
      "y": 2
    },
    {
      "x": 43,
      "y": 2
    },
    {
      "x": 44,
      "y": 2
    },
    {
      "x": 45,
      "y": 2
    },
    {
      "x": 46,
      "y": 2
    },
    {
      "x": 47,
      "y": 2
    },
    {
      "x": 48,
      "y": 2
    },
    {
      "x": 49,
      "y": 2
    },
    {
      "x": 50,
      "y": 2
    },
    {
      "x": 51,
      "y": 2
    },
    {
      "x": 52,
      "y": 2
    },
    {
      "x": 53,
      "y": 2
    },
    {
      "x": 54,
      "y": 2
    },
    {
      "x": 55,
      "y": 2
    },
    {
      "x": 56,
      "y": 2
    },
    {
      "x": 57,
      "y": 2
    },
    {
      "x": 58,
      "y": 2
    },
    {
      "x": 59,
      "y": 2
    },
    {
      "x": 60,
      "y": 2
    },
    {
      "x": 61,
      "y": 2
    },
    {
      "x": 62,
      "y": 2
    },
    {